{
  "schemaVersion": "1.0.0",
  "componentSlug": "slide-switch-spdt",
  "asset": {
    "path": "assets_db/3d_models/glb/slide-switch-spdt.glb",
    "sha256": "b7a27506560a2589a91d0ab23ae9082d90a5d5541382bce333231a35c6be7e1c",
    "format": "glb",
    "scaleStatus": "real-world",
    "thumbnailPath": null
  },
  "physicalDimensions": {
    "unit": "millimeter",
    "width": 13,
    "depth": 7,
    "height": 17.6,
    "measurementScope": "overall-including-pins",
    "source": "measured",
    "confidence": 0.9
  },
  "coordinateSystems": {
    "authoring": {
      "space": "threejs-object-local",
      "handedness": "right",
      "upAxis": "+Y",
      "frontAxis": "+Z",
      "unit": "meter"
    },
    "runtime": {
      "space": "gltf-model-local",
      "handedness": "right",
      "upAxis": "+Y",
      "frontAxis": "+Z",
      "unit": "meter",
      "modelUnitsPerMillimeter": 0.001
    },
    "anchorsStoredIn": "runtime"
  },
  "origin": {
    "targetReference": "mounting-surface-center",
    "referencePoint": [
      0,
      0,
      0
    ],
    "normalized": true,
    "description": "Origin is centered on the breadboard insertion plane between the outer leads."
  },
  "orientation": {
    "defaultRotationQuaternion": [
      0,
      0,
      0,
      1
    ],
    "normalized": true,
    "markers": [
      {
        "key": "throw-a-left",
        "pinKey": "THROW_A",
        "direction": "-X",
        "description": "Throw A is the runtime -X lead."
      }
    ]
  },
  "pins": [
    {
      "pinKey": "THROW_A",
      "label": "Throw A",
      "nodeName": "pin_throw_a",
      "position": [
        -0.00254,
        0,
        0
      ],
      "outwardDirection": [
        0,
        -1,
        0
      ],
      "connector": {
        "gender": "male",
        "form": "lead",
        "pitchMillimeter": 2.54,
        "diameterMillimeter": 0.5
      },
      "electrical": {
        "role": "signal",
        "aliases": [
          "A",
          "1"
        ]
      },
      "mounting": {
        "breadboardCompatible": true,
        "insertionDepthMillimeter": 6
      },
      "confidence": 0.95,
      "sourceObject": "pin_throw_a",
      "notes": [
        "Procedural anchor at the measured 2.54 mm breadboard grid position."
      ]
    },
    {
      "pinKey": "COMMON",
      "label": "Common",
      "nodeName": "pin_common",
      "position": [
        0,
        0,
        0
      ],
      "outwardDirection": [
        0,
        -1,
        0
      ],
      "connector": {
        "gender": "male",
        "form": "lead",
        "pitchMillimeter": 2.54,
        "diameterMillimeter": 0.5
      },
      "electrical": {
        "role": "signal",
        "aliases": [
          "COM",
          "2"
        ]
      },
      "mounting": {
        "breadboardCompatible": true,
        "insertionDepthMillimeter": 6
      },
      "confidence": 0.95,
      "sourceObject": "pin_common",
      "notes": [
        "Procedural anchor at the measured 2.54 mm breadboard grid position."
      ]
    },
    {
      "pinKey": "THROW_B",
      "label": "Throw B",
      "nodeName": "pin_throw_b",
      "position": [
        0.00254,
        0,
        0
      ],
      "outwardDirection": [
        0,
        -1,
        0
      ],
      "connector": {
        "gender": "male",
        "form": "lead",
        "pitchMillimeter": 2.54,
        "diameterMillimeter": 0.5
      },
      "electrical": {
        "role": "signal",
        "aliases": [
          "B",
          "3"
        ]
      },
      "mounting": {
        "breadboardCompatible": true,
        "insertionDepthMillimeter": 6
      },
      "confidence": 0.95,
      "sourceObject": "pin_throw_b",
      "notes": [
        "Procedural anchor at the measured 2.54 mm breadboard grid position."
      ]
    }
  ],
  "placement": {
    "mountingType": "breadboard-insert",
    "mountingPlaneNormal": [
      0,
      1,
      0
    ],
    "rotationPolicy": "snap-yaw",
    "allowedYawDegrees": [
      0,
      90,
      180,
      270
    ],
    "keepOutMarginMillimeter": 0.5
  },
  "provenance": {
    "authorGithub": "a3222",
    "branch": "feat/assets-discrete-io-pack",
    "method": "other",
    "sourceTool": "Three.js GLTFExporter",
    "createdAt": "2026-07-28",
    "status": "candidate",
    "reviewerGithub": null,
    "approvedAt": null
  },
  "notes": [
    "Nominal real-world procedural model; breadboard occupancy 3 columns x 3 rows.",
    "Pin spacing, polarity, and terminal roles are encoded in named GLB nodes and metadata."
  ]
}
