{
  "schemaVersion": "1.0.0",
  "componentSlug": "dc-motor",
  "asset": {
    "path": "assets_db/3d_models/glb/dc-motor.glb",
    "sha256": "8d248b7b4e1af124780077e5b392589499472475c482c82f020181bb1c57e579",
    "format": "glb",
    "scaleStatus": "uncalibrated",
    "thumbnailPath": null
  },
  "physicalDimensions": {
    "unit": "millimeter",
    "width": 27,
    "depth": 20,
    "height": 15,
    "measurementScope": "overall-including-pins",
    "source": "nominal",
    "confidence": 0.5
  },
  "coordinateSystems": {
    "authoring": {
      "space": "blender-object-local",
      "handedness": "right",
      "upAxis": "+Z",
      "frontAxis": "-Y",
      "unit": "meter"
    },
    "runtime": {
      "space": "gltf-model-local",
      "handedness": "right",
      "upAxis": "+Y",
      "frontAxis": "+Z",
      "unit": "model-unit",
      "modelUnitsPerMillimeter": null
    },
    "anchorsStoredIn": "runtime"
  },
  "origin": {
    "targetReference": "custom",
    "referencePoint": [
      0,
      0,
      0
    ],
    "normalized": false,
    "description": "Draft origin and anchors are stored in current GLB local coordinates."
  },
  "orientation": {
    "defaultRotationQuaternion": [
      0,
      0,
      0,
      1
    ],
    "normalized": false,
    "markers": [
      {
        "key": "wire-end",
        "pinKey": "POSITIVE",
        "direction": "-X",
        "description": "Pins are placed near the visible wire end and require visual review."
      }
    ]
  },
  "pins": [
    {
      "pinKey": "POSITIVE",
      "label": "+",
      "nodeName": "pin_positive",
      "position": [
        0,
        -0.3,
        0.3
      ],
      "outwardDirection": [
        0,
        -1,
        0
      ],
      "connector": {
        "gender": "male",
        "form": "wire-end",
        "pitchMillimeter": null,
        "diameterMillimeter": null
      },
      "electrical": {
        "role": "power",
        "aliases": [
          "+",
          "red",
          "M+",
          "positive"
        ],
        "functions": [
          "power"
        ]
      },
      "mounting": {
        "breadboardCompatible": false,
        "insertionDepthMillimeter": null
      },
      "confidence": 0.5,
      "sourceObject": "pin_positive",
      "notes": [
        "Draft wire-end anchor for 3D Asset Lab visual inspection."
      ]
    },
    {
      "pinKey": "NEGATIVE",
      "label": "-",
      "nodeName": "pin_negative",
      "position": [
        0,
        -0.35,
        0.3
      ],
      "outwardDirection": [
        0,
        -1,
        0
      ],
      "connector": {
        "gender": "male",
        "form": "wire-end",
        "pitchMillimeter": null,
        "diameterMillimeter": null
      },
      "electrical": {
        "role": "ground",
        "aliases": [
          "-",
          "black",
          "M-",
          "negative"
        ],
        "functions": [
          "ground"
        ]
      },
      "mounting": {
        "breadboardCompatible": false,
        "insertionDepthMillimeter": null
      },
      "confidence": 0.5,
      "sourceObject": "pin_negative",
      "notes": [
        "Draft wire-end anchor for 3D Asset Lab visual inspection."
      ]
    }
  ],
  "placement": {
    "mountingType": "free",
    "mountingPlaneNormal": [
      0,
      1,
      0
    ],
    "rotationPolicy": "free-yaw",
    "allowedYawDegrees": [],
    "keepOutMarginMillimeter": 1
  },
  "provenance": {
    "authorGithub": "codex",
    "branch": "integration/team-latest",
    "method": "other",
    "sourceTool": "add-dc-motor-metadata.mjs",
    "createdAt": "2026-07-31",
    "status": "candidate",
    "reviewerGithub": null,
    "approvedAt": null
  },
  "notes": [
    "Generated as candidate metadata for the DC motor GLB.",
    "Pin positions are provisional wire-end anchors and should be visually adjusted in the 3D Asset Lab.",
    "Power: small DC motors should be powered from a motor-rated external supply matched to the motor voltage, not directly from an Arduino GPIO pin.",
    "Current: running and stall current are motor-dependent and can be much higher than logic-pin limits; size the driver and supply for stall current.",
    "Grounding: when controlled by Arduino through a driver, connect Arduino GND and motor supply GND together.",
    "External power: required for practical Arduino control because the motor load should be supplied through a motor driver.",
    "Common ground: when controlled by Arduino through a driver, connect Arduino GND and motor supply GND together.",
    "GLB texture resolution and mesh density were reduced for web delivery; the asset remains an uncalibrated candidate."
  ]
}
