{
  "schemaVersion": "1.0.0",
  "componentSlug": "resistor-220-ohm",
  "asset": {
    "path": "assets_db/3d_models/glb/resistor-220-ohm.glb",
    "sha256": "781a89587bcb58e9b915045a9cfaf40c9265a951221da60c033ec50cd356e842",
    "format": "glb",
    "scaleStatus": "real-world",
    "thumbnailPath": "assets_db/2d_svgs/raster_sources/resistor-220-ohm-top.png"
  },
  "physicalDimensions": {
    "unit": "millimeter",
    "width": 10.9,
    "depth": 2.3,
    "height": 7.15,
    "measurementScope": "mounting-envelope",
    "source": "nominal",
    "confidence": 0.9
  },
  "coordinateSystems": {
    "authoring": {
      "space": "blender-object-local",
      "handedness": "right",
      "upAxis": "+Z",
      "frontAxis": "-Y",
      "unit": "meter"
    },
    "runtime": {
      "space": "gltf-model-local",
      "handedness": "right",
      "upAxis": "+Y",
      "frontAxis": "+Z",
      "unit": "meter",
      "modelUnitsPerMillimeter": 0.001
    },
    "anchorsStoredIn": "runtime"
  },
  "origin": {
    "targetReference": "mounting-surface-center",
    "referencePoint": [0, 0, 0],
    "normalized": true,
    "description": "Origin is the midpoint between both lead entry points on the breadboard mounting plane."
  },
  "orientation": {
    "defaultRotationQuaternion": [0, 0, 0, 1],
    "normalized": true,
    "markers": [
      {
        "key": "lead-a-left",
        "pinKey": "LEAD_A",
        "direction": "-X",
        "description": "LEAD_A is the left geometric endpoint; the resistor is non-polarized."
      }
    ]
  },
  "pins": [
    {
      "pinKey": "LEAD_A",
      "label": "Lead A",
      "nodeName": "pin_lead_a",
      "position": [-0.00508, 0, 0],
      "outwardDirection": [0, -1, 0],
      "connector": { "gender": "male", "form": "lead", "pitchMillimeter": 10.16, "diameterMillimeter": 0.44 },
      "electrical": { "role": "passive", "aliases": ["A", "1", "lead-1"] },
      "mounting": { "breadboardCompatible": true, "insertionDepthMillimeter": 3 },
      "confidence": 0.95,
      "sourceObject": "pin_lead_a",
      "notes": ["Geometric endpoint only; electrically interchangeable with LEAD_B."]
    },
    {
      "pinKey": "LEAD_B",
      "label": "Lead B",
      "nodeName": "pin_lead_b",
      "position": [0.00508, 0, 0],
      "outwardDirection": [0, -1, 0],
      "connector": { "gender": "male", "form": "lead", "pitchMillimeter": 10.16, "diameterMillimeter": 0.44 },
      "electrical": { "role": "passive", "aliases": ["B", "2", "lead-2"] },
      "mounting": { "breadboardCompatible": true, "insertionDepthMillimeter": 3 },
      "confidence": 0.95,
      "sourceObject": "pin_lead_b",
      "notes": ["Geometric endpoint only; electrically interchangeable with LEAD_A."]
    }
  ],
  "placement": {
    "mountingType": "breadboard-insert",
    "mountingPlaneNormal": [0, 1, 0],
    "rotationPolicy": "snap-yaw",
    "allowedYawDegrees": [0, 90, 180, 270],
    "keepOutMarginMillimeter": 0.8
  },
  "provenance": {
    "authorGithub": "tmd9898-dot",
    "branch": "feat/asset-sensor-discrete-components",
    "method": "blender-empty",
    "sourceTool": "Blender 5.2 and prepare_assigned_components_blender.py",
    "createdAt": "2026-07-22",
    "status": "candidate",
    "reviewerGithub": null,
    "approvedAt": null
  },
  "notes": [
    "The source body and color bands were normalized to a 6.5 mm by 2.3 mm body.",
    "Leads were rebuilt for a four-grid breadboard span of 10.16 mm and a 3 mm insertion depth.",
    "The resistor is non-polarized."
  ]
}
